qTag,Done,Question,General,Facebook,LinkedIn,Twitter,Instagram,Reddit,Tumblr,Tik Tok,BeReal,YouTube,Snapchat,4Chan,Twitch,,
,,Community,,,,,,,,,,,,,,,
C1,TRUE,"I see positive conversation (ex. Friendly chitchat, education, humor) on the platform.","This question aims to understand the frequency of positive environments on social media. In general, people do frequently see positive conversation on social media, more frequently than negative conversation.","People frequently see positive conversation on Facebook. This is because communities are built around family, friends, and people in groups with mutual interests.","On average people frequently see positive conversation on LinkedIn. Although most users occasionally see this, many see positive conversation very frequently. As a professional setting, LinkedIn will be polite and may congratulate others on achievements.",Twitter users see friendly conversation frequently to occasionally. Q,"Frequently see positivity. Q, especially from friends and family.","Q. More frequently than other social media, Reddit may be more community based","Very friendly, more community based","Frequently, community based. Q","Varying responses but leaning very frequently, app for friends to support each other","Occasionally, no specfic lean. Depends on comments, can vary significantly.","Frequently, may be friends supporting friends similar to BeReal","Occasionally, leaning rarely. May be more negative conversation","Frequently, Q depends on who you follow, chats tend to be positive","Responses vary, but following positive accounts will lead to positive conversation.",
C2,TRUE,"I see negative conversation (ex. disputes, name-calling, trolling) on the platform.","This question aims to understand the frequency of negative environments on social media. In general, people do often see negative conversation on social media, less frequently than positive conversation.","Frequently see negative conversation on Facebook. Extended families may argue, or Q","People very rarely see negativity on LinkedIn. Since this is a professional environment, politeness is encouraged.","Very frquently, most see it occasionally if not more often. Q","Occasionally. Q, but friends and family may have less negativity",Frequently. Q,"Occasionally, Q but more niche community discourages negativity","Frequently, Q. Short content may lose nuance.",Most say never. Close friends in personal community,"Occasionally, Q. Depends on comments","Rarely. Personal relationships are less negative, but Snap is less personal than BeReal","Very frequently, unanimous response. Hostile environment","Occasionally leaning rarely. Random chatters can be negative, depends who you watch, Q",Some communities or users may debate or troll to upset others. Less personal relationships cause more negativity,
C3,TRUE,I see perspectives and opinions that are different from my own on the platform.,"Seeing different opinions is both good and bad, as it prevents echo chambers but may cause discomfort. In general people occasionally see opinions that differ from theirs.",Q,Q,R,Q,"R, wide community","Occasionally Q, but many responses say rarely, may be echo chamber to some communities","Occasionally Q, but many responses say rarely, may be echo chamber to some communities",Responeses mostly occasionally or never; may be an echo chamber but may also be that friends are not posting their opinions,"Q, YouTube content may mention other views to counter them ","Rarely, may be echo chamber or friends not posting opinions often","Very frequently, nearly unanimous response. Wide variety of opinions related to negativity","Most people say rarely, may be echo chamber or lack of voiced opinions","People occasionally see views that differ from theirs, which may lead to debate ","Frequently, this may be linked with negative conversation"
C4,TRUE,The platform prioritizes my friends’ posts over other posts.,"Overall, social media was built on friendly connections, but, in recent years, sponsored and recommended content is making waves.","Facebook remains a popular platform for connecting with loved ones, however, the platform frequently displays newsfeed and recommended content. Although users still primarily see posts from their friends, there is a tight balance between these posts and the suggested content, while other social media platforms, like BeReal and Instagram, place a greater emphasis on personal connections.","Although LinkedIn is definitely a platform to connect with coworkers, your feed may have a mix of corporate and personal posts. Respondents tend to agree that the feed tends to proiritize connections, but not as strongly as places like Instagram or BeReal. Once again, we are unsure if our respondents tend to use the feed or just the profile features, so these answers may be skewed.","Highly varied, You will definitely still see the postsof people you follow, but the users tend to ""slightly agree,"" while places like BeReal and Instagram are stronger in this regard.","Instagram still tends to be a place to follow friends and post photos, even if recommended content is being pushed more into the feed. Instagram users tend to agree that they will see their friends first.","This social media tends not to show you content from people you know or follow, instead using it's community structure to show you posts from your requested circles. ","High variance in the agree, but tend to agree. Mutual culture","This social media tends not to show you content from people you know or follow, instead relying on it recommendation algorithm to keep you coming back.","Only friends, unique","This social media tends not to show you content from people you know or follow, instead relying on it recommendation algorithm to keep you coming back.","Lost influencers, mostly just friends on stories. ",The anonymity on 4chan means that you will absolutely not know who are your friends on 4chan. 100% of respondents agree that this isn't the space to see people you know in real life.,"This social media tends not to show you content from people you know or follow, instead relying on you favorite streamers to keep you coming back.",,
C5,TRUE,The platform prioritizes sponsored posts over other posts.,This question aims to understand whether user communities and their posts are prioritized over advertisements and sponsorships.,"Users strongly agree that Facebook prioritizes sponsored posts, meaning that corporate interest may be prioritized over user posts. Instagram follows in agreement, and Meta Inc. is well known for profiting off of advertisements.",Q,Q,"Users strongly agree that Instagram prioritizes sponsored posts, meaning that corporate interest may be prioritized over user posts. Facebook follows in agreement, and Meta Inc. is well known for profiting off of advertisements.","People slightly disgree that Reddit prioritizes sponsored posts. These communities feel more natural, and less corporate","Users either slightly agree or strongly disagree that Tumblr prioritizes sponsored posts; it is possible that people use Tumblr on the web, and have ad blockers, but Tumblr does push some sponsored posts.",Q,"Strong disagree, BeReal has no ads or sponsorships",,"People agree and often strongly agree that YouTube prioritizes sponsored posts. This includes unskippable ads. Similar to Meta Inc., YouTube is owned by Google, which is a high-profit company","People strongly disagree, 4Chan has sponsored ads at the top of forums, but not within posts","Responses vary, but Q","Peple tend to slightly agree that this prioritizes sponsored posts over other posts. While sponsorship is common, other posts are still very much visible.",
C6,TRUE,I see two-way discussion between content creators and audiences on the platform.,"In general, people say they occasionally see two-way discussion on social media. ","Most people agree that two-way discussion is common on Facebook, and people overwhelmingly see discussion frequently. This may be because people often respond to posts from friends and family on their feed.","Most people occasionally see two-way discussion on LinkedIn, with most responses between being frequent and rare. This may be because LinkedIn is a professional environment with users discussing topics such as new jobs, research and new ideas.","Most people frequently see two-way discussion. This may be due to Twitter's reply feature allowing for easy, brief responses to posts.","People overwhelmingly say tht they occasionally see two-way discussion on Instagram. Instagram is not built for long-form conversation, but users may spend time having discussions in the coments of posts.","Most people see two-way discussion on Reddit, with responses leaning towards frequently or very frequently. Due to Reddit's nature as a forum-based social media, many posts are written with the intention of starting a conversation for users to reply to.","High variance, but people tend to see two-way discussion very frequently. Tumblr makes it very easy to see responses to posts.","There is high variance, with most people occasionally seeing two-way discussion on TikTok. While duets, live streams and comments are means to have two-way discussions, they are not frequent.","Responses are either ""frequently"" or ""never."" Since this is friends-only, this is contingent on whether or not your friends will respond to each other's posts.","Occasionally or rarely, creators may respond to comments but discussion is not a priority","Most conversation is private, most respondents say they rarely see it with many people seeing conversation very rare/never",Too low confidence to say,"Very frequently, streamers tend to respond to chatters",,
C7,TRUE,It is easy to make new friends on the platform.,"This question was aimed whether users are able to exand their community by making new personal connections. In general, social media users tend to slightly disagree, thus making new friends on social media tends to be somewhat difficult.","In general, people agree that it is easy to make new friends on Facebook. There are a considerable number of people that disagree, and this may deend on your involvement in groups or other pages.","In general, people lean towards slightly agreeing that it is easy to make new friends on LinkedIn. This may be because LinkedIn recommends people within the same organizations, so they may suggest poeple you know or have similar interest to.","While people lean towards slightly agree, the responses vary significantly. Users may find it easy or difficult to make friends.",People slightly disagree that making new friends is easy on Instagram. This may be because users tend to follow pre-existing friends.,"People overwhelmingly disagree that it is easy to make new friends on Reddit. This may be because Reddit is topic driven and does not emphasize following other users, and conversations are often tied to a specific topic or subject.","Although there are few responses, people tend to agree that making new friends on Tumblr is easy. This may be due to Tumblr's culture of ""mutual"" followers, and the ability to chat via replying to posts or reblogging.","In general, people disagree that you can make new friends on TikTok. Since TikTok is only videos and you often cannot message people that are not following you, communication is de-emphasized.","There are very few responses to this question, with most people either slightly agreeing or disagreeing. This may be ebcause BeReal prioritizes your existing friends, and does not aim for you to make new friends through the platform.","People strongly disagree, since YouTube has no way to message other users or add friends, and recommends content for entertainment.","Responses vary here. In general, people slightly disagree, but many people do also agree. This may be subjective since Snapchat relies primarily on pre-existing friendships, through which some people are able to make new friends.","Users strongly disagree here. 4Chan allows no usernames or direct messaging, so staying in contact with an anonymous user will be difficult.","Responses vary, but people slightly disagree. This is because Twitch's design focuses more on individual streams rather than direct interaction between users, however people may still make friends from these streamer's communities.",,
,,Self,,,,,,,,,,,,,,,
S1,TRUE,The users I interact with feel like individual human beings.,"This question was aimed to touch on the feeling that the internet ""isn't real"" and that other users may be bots or not. In general, people do agree that they are interacting with other individuals.","People agree that they interact with other individuals on Facebook. Often these are people that users know, or friends of their friends, so this close connection helps users feel more real.","People agree that users feel like real individuals, but slightly less than Facebook. This may be due to LinkedIn's professional nature and the frequency of recruiters who use automated messages to reach potential candidates.","Q, this may be due to bots, or because 280-character text posts lose some nuance of real people.","Q. On Instagram, posts may be filtered to show a person's ideal image, which may feel less real.","Q. There is a considerable amount of disagreeing, which may be from trolls, but people tend to agree.",People tend to agree. This may be due to Tumblr's niche content,"Q, 60 second videos may also lose nuance similar to Twitter","Overwhelmingly agree. This is the idea behind BeReal, that you see your friends being authentic","Varied answers, but people slightly agree. Users don't tend to interact with creators, but commentors may feel like bots.","People agree. They are mostly interacting with their friends. But similar to Instagram, Snapchat has filters and may feel less authentic","Answers very significantly. Low confidence. Many people strongly disagree, which may be due to a high presence of trolls","People tend to agree, very few disagrees. Streams are slow-paced and people likely gravitate towards streams that feel personable and authentic. The concept of streams being live also makes people feel more real.","People slightly agree that they are interacting with individuals, although a considerable amount disagrees.",
S2,TRUE,The platform encourages me to present an identity.,"This question aims at how identity-focused a social media is. In general, people agree that social media encourages identity.",Q,"Q, specifically requires a professional identity","Q, slight agree",Q,"Disagree, not encouraged to present an identity. De-emphasized identity, little profile customization, and focus on topics over people","Varied answer with little confidence, most responses slightly agree","Strong range of responses, people slightly agree. People are encouraged to post themselves, but identity is not priority","Q, all about authentic identity","Users disagree, identity is not emphasized compared to viewing, and users are not incentivized to post.",Q,"High variance and low confidence, responses agree and disagree. Not much to say","Varied responses, largely disagree. More about watching than presenting an identity","People tend to agree. This social media is more personal, revolving around the traditional profile and feed of friend/following posts",
S3,TRUE,The persona I present on the platform is authentic.,"This question aims to identify whether people believe they are being themselves on social media. Most people agree, with many strongly agreeing that they are authentic.","People agree that their Facebook personas are authentic. This is how they present themselves to family and friends, so it will relate to themselves.","People strongly agree that their LinkedIn personas are authentic. This is how they present themselves to coworkers and peers, so it will relate to themselves.","In general, people agree that their Twitter accounts represent an authentic persona. However a large number of people disagree, and believe their personas are not authentic. ","People agree that their Instagram personas are authentic. Like Facebook, this is how they present themselves to family and friends, so it will relate to themselves.",People agree that their Reddit personas are authentic. Their posts and topics relate to their interests.,"Answers vary. Not everyone on Tumblr will be presenting an authentic persona, but many will be.","Most people agree that their personas are authentic. However, a significant amount of people disagree.","People agree that their BeReal personas are authentic. This is how they present themselves to family and friends by showing a daily image, so it will relate to themselves.","Despire that identity is not emphasized, most people still agree that their personas are authentic. Likely, when commenting on videos they are not trolling","Most responses agree, people are being authentic with their friends","Varying answers, most people slightly disagree. May be trolling or disingenuous ","People agree or slightly agree, low variance. People are being themselves, but the platform does not significantly encourage self.",,
S4,TRUE,The platform enables me to customize my profile.,"In general, people agree that social media allows profile customization. However the more customization, the more the social media promotes self identity.","Users agree strongly that Facebook enables profile customization. This includes headers and profile pictures, however all posts also appear on the user's profile.","Users strongly that LinkedIn enables profile customization. This is one of LinkedIn's key features, as your profile showcases your professional identity and contains your skills and experiences.","People agree that Twitter allows profile customization to an extent. However this is limited to profile picture, header and description.","People agree that Instagram allows profile customization to an extent. However this is primarily limited to profile picture, header and description. Instagram does also allow users to feature stories on their profile as well.","People slightly agree that Reddit enables customization. This includes a profile picture, banner, display name and about section, but since following is de-emphasized, these features are entirely based on preference.","Most people strongly agree. Not only does Tumblr have the traditional display name, about, profile picture and header, it also allows users to adjust the color scheme of their blogs or completely edit the HTML of their web blogs.","People tend to slightly agree. TikTok allows profile pictures, names and descriptions","There is high variance, but most people slightly agree. BeReal allows a profile picture and name.","People tend to slightly agree. Channels can have a profile picture, header and description, but these are not required or emphasized.","People agree, Snapchat allows for the creation of Bitmoji, a customizable avatar.","People strongly disagree, you cannot create or customize a profile on 4Chan","People slightly agree, Twitch allows for a profile picture, name, header and about. However only name is visible on comments",,
S5,TRUE,I spend time viewing and curating my own profile.,"This question aims to emphasize how much time is spent on profile customization. There is high variance, but in general uses do not curate or view profiles.",Q,"Users agree that they curate their profiles. This is the main feature of LinkedIn and profiles are emphasized to other users, so curating a profile is important.",Q,"Q. Some people agree, and do spend time customizing their profile, but most do not. May look back at photos and memories more than other social media","Q, low options or emphasis on profiles","High variance, equal amounts agree and disagree. Option to curate, not needed","Strong disagree Q, profiles not emphasized. Mostly for watching","High variance low confidence, people may look back at their memories","Strong disagree, profiles not viewed or modified. Mostly for watching","Q lean disagree, people may customize their bitmojis but SC does not have much profile to view or curate","People strongly disagree, you cannot view a profile on 4Chan","Most people strongly disagree, profiles are not viewed after creation, no emphasis. Streamers may curate","People slightly disagree that they spend time curating their profiles, which means they likely do not edit it after creation.",
,,Discovery,,,,,,,,,,,,,,,
D1,TRUE,I see posts by small creators.,Q,"Q, most people see small creators","Q, people follow peers and professionals but may see posts from large organizations",Q,Q,"People see posts by small creeators more frequently on Reddit than average. This may be due to Reddit being a topic-based platform, and creator following is de-emphasized","Tumbr users say that they very frequently see posts by small creators. On tumblr, follow counts are not visible, so most creators on the platform feel small.","Q, more frequent than occasional. Algorithm can push anyone's videos ","VF and Never; all friends so most users are small creators, and many respondants may not consider their friends creators",P; occasionally or rarely. Many people may only be recommended large accounts related to accounts they already follow.,"High variance, but most people answer never. They do not consider their friends creators, and SC hosts creators but these are not emphasized","High variance, Q, LC, lean towards VF since most people are anonymous, some users may not consider other posters ""creators""","Occasionally with wide variance: Most people may watch their favorite streamers who are large creators, others may have favorite streamers who are small, or watch friends","Most people say that they see posts by small creators on social media occasionally, with many seeing this content frequently.",
D2,TRUE,"On average, how long do you spend in a single session on the platform?","People overwhelmingly spend less than 10 minutes on social media, with higher time periods following almost an exponential decay","Most people use Facebook for less than 30 minutes, and many use it for less than 10. People may be making a quick update, responding to messages, or viewing a few posts.","Most people spend less than 10 minutes on LinkedIn. Users may be checkinf for updates, sending quick messages, or briefly updating their profiles.","Most people spend less than ten minutes on Twitter. While others spend 30 minutes or less, almost nobody spends more than 30 minutes. This may be due to Twitter's content being limited to 280 characters.","Most people spend less than ten minutes on Instagram, but there is high variance. While viewing a few posts would require spending less than ten seconds, Instagram features messaging and video reels which may cause users to spend more time on the app.","While most people spend less than ten minutes on Reddit, the amount of time spent varies. Reddit posts may be longer-form, and reading and responding to detailed posts may take considerable time.","There is high variance, but most tumblr users spend 30 minutes or less on the platform. Posts may be longer-form content, or users may enjoy posts more often.","TikTok has the highest amount of responses using the app in sessions of less than ten minutes or more than one hour. Despite TikToks being one minute or less, meaning that users can view one or two TikToks then close the apQ, however the algorithm is also good at recommending more content to watch.","Unanimously, all users spend less than ten minutes per session. This is because BeReal has very little content, aside from posting within a 2 minute window and viewing friends' posts.","Watch time varies, but most people spend well beyond 10 minutes on YouTube. This is because most videos that are not YouTube Shorts are above ten minutes, with many streams and videos spanning over an hour","Nearly everyone uses Snapchat for ten minutes or less. This is because Snapchat is designed for short, quick interactions and disappearing messages emphasize temporary use.",Most people spend less than 10 minutes on 4Chan. These posts also tend to be short,"Most people spend over 30 minutes on Twitch, with many spending more than an hour. This is because Twitch focused on long form content in the form of video streams, which often run for many hours",,
