qTag,Done,Question,General,Facebook,LinkedIn,Twitter,Instagram,Reddit,Tumblr,Tik Tok,BeReal,YouTube,Snapchat,4Chan,Twitch,,
D3,TRUE,This platform prioritizes ______ content.,"In general, social media prioritizes video more than text or image content.","Many people feel that Facebook prioritizes image content, although answers vary, meaning that Facebook may support a variety of content","Most people believe LinkedIn prioritizes text content. This includes status updates, research and job postings.","Most people agree that Twitter prioritizes text content. This supports Twitter's design, which supports 280 character text posts. Images without text may be posted, but less frequently.","Most people agree that Instagram prioritizes image content, which was the original goal of Instagram. However, more than 1/5 of responses agreed that Instagram prioritizes video, which it has begun promoting in its Reels feature.","Most people agree that Reddit prioritizes text content, due to many subreddits being dedicated to text posts.","Answers vary, but most agree that Tumblr has no priority. This may be because Tumblr supports a wide variety of content including text, image, video, and audio","Overwhelmingly, people agree that TikTok solely prioritizes video, since this is the main scrolling feed.","Overwhelmingly, people agree that BeReal solely prioritizes image, since this is the main scrolling feed and the only type of post users can create.","Overwhelmingly, people agree that YouTube solely prioritizes video.","Most people agree that Snapchat prioritizes image content, since this is the main form of content users send. However, many people believe Snapchat prioritizes video, since the content of its Discover page is entirely video","There are few responses, but most people believe 4Chan prioritizes text and image content","Overwhelmingly, people agree that Twitch solely prioritizes video.",,
D4,TRUE,It is easy to create my own content.,People agree that making their own content in social media is easy.,Q,Q,Q,"Q, not as strong agree as Twitter or Reddit, since images are often edited before uploading",Q,Q,"Q, not as high as Twitter or Reddit since videos may need editing","Q, very low barrier to entry","Very varied response. While it is easy to upload a video, many videos already posted are edited and highly produced, which may be intimidating to new users.",Q,Q,"Twitch has a higher barrier to entry. People slightly agree that it is easy to create content, but very often this content needs external setup. ","People agree that content is easy to create, since social media is designed to encourage posting",
D5,TRUE,I am entertained by the content on the platform.,Most people are entertained by social media! A majority of responses are between very frequent entertainment and occasional entertainment,"Q, a Typical social media that is entertaining","People are not often entertained by LinkedIn. Although the highest number of respondents said they are occasionally entertained, responses lean negative. Content is education-based and professional, used for networking, which may make it dry",Q,Q,"Q, more very frequently . Broader content","Very frequently, users of tumblr like tumblr. Possibly more user specific, self-cultivated content","Q, more very frequent and frequent. Algo good recs cultivated","Large range, not for entertainment","Most say VF and close second F, Good recommendations, self selected","Q, occasionally leaning negative. Friends are not always entertaining, and Discover content is not appealing","High variance, Q, LC","Very frequently, users self-select into streams to watch, self selected","People follow the overall trend of being mostly entertained by social media, with most people responding that they are frequently or occasionally entertained. These are follower-based and have weaker recommendation algorithms",
D6,TRUE,I am educated by the content on the platform.,"In general, users are occasionally educated by content on their social media platforms","Many users say they are occasionally educated by Facebook, but most say they are rarely or never educated. This may be due to the personal style of many posts, as well as misinformation.","People are often educated by content on LinkedIn, with most respondants answering frequently or occasionally. LinkedIn is for professionals and academics, thus posts will often contain educational information about research or a new discovery.","Occasionally, leaning rarely. Not a place for reliable information","Rarely. A personal platform, most people post photos of themselves and their experiences, not education","Frequently. Subreddits like r/TIL (Today I Learned) are focused primarily on education, with r/science one of the most popular",Q,Q,Q,"Frequently, most people responding between VF and O. A lot of YouTube videos are educational, teaching abt a broad variety of topics",Q,"Q, low confidence","Most responses rarely/very rarely. A place for entertainment, not education","Occasionally. Maybe stumble on some education, not focus ","Occasionally. Maybe stumble on some education, not focus "
D7,TRUE,I feel bored/unsatisfied after viewing content on the platform.,"Althought you'd except entertainment based platforms to rarely leave users unsatisfied, overall, users are occassionally unsatisfied.","Surprisingly, Facebook is one of the platforms that struggles the most compared to other media we asked about. This could be a variety of reasons, such as not enjoying your connections posts or the recommended content, or that our respondents for facebook skewed older and that generation reflects on their view experience differently. Whatever the reason, keep this in mind!","Infrequent LinkedIn users primarily use it as a digital resume, rather 
than for its content. The platform's corporate culture inherently makes 
the content less ""entertaining"" than it's contemporaries, leading to 
occasional user boredom, but this is expected and some users are satisfied with that.","This one a platform was one of the worst in terms of boredom. Although entertaining, maybe Q? maybe follows? maybe strucutre?",Q,"occassionally, variety of factors (no creators? Q?)",users of tumblr like tumblr,"Q, video content",format: know what you are going to get,"Q, video content",Snapchat's loss of creators in the 2017 redesign has hurt the quality of it's content. click through stories out of habit,forum structure,return to certain streamers,This is one of the platforms that rarely leaves users unsatisfied.,The platform's recommendation algorithm may not be as effect as its contemporaries.
D8,TRUE,Misinformation is spread through the platform.,"Misinformation is a problem for all platforms, but it is more well known on some than others.","Facebook's Cambridge Analytica scandal as forever marked it as suseptabile to misinfromation, especially through it's targeted ads. Posts are linked to how often they've been shared (likes, re-shared,etc.), so inflammatory misinformation is a tantalizing route to internet fame. The echo-chambers of community bubbles or recommendation bubbles can also contribute to a space where misinformation is not questioned.","As a professional environment, users tend to be careful about what they post. People tend to post about their professional successes or new relevant to their field, and nothing that makes them look bad. Although misinfomation is still present on the platform, the culture limits discussion and spread.",P but more,Q,Q,Q but less / perception of less,Q,"BeReal has limited posting features and small friend circles, so users agree that missinformation is likely not a major issue on the platform. etc.etc",Q,"friend connections, ","Anonymity, culture","Although responses were divided, generally misinformation is occassionally or rarely spread. Streamers will generally control the discussion, so the stop of misinformation relies on them etc etc","Posts are linked to how often they've been shared (like, re-shared,etc.) so inflammatory misinformation is a tantalizing route to internet fame. The echo-chambers of community bubbles or recommendation bubbles can also contribute to a space where misinformation is not questioned.",
,,Agency,,,,,,,,,,,,,,,
A1,TRUE,I can control what I see on the platform.,"Social media will always be tied to the content a user cultivates, whether thats from following creators or from trying to tune their recommendation algorithm. This isn't always a process that the user will always have minute control of, but the user will play at least a minimal roll.","The recommendation algorithm can feel out of a user's control. Although friendships are valuable on the platform, the lean towards newsfeed and other recommendation algorithms may make the user feel powerless at times.","Survey respondents may only user profile features, so the survey responses may not accurately reflect the feed. Overall, posts will be recommended if posted or liked by a connection, so your feed will be linked to your friend's choices.","Twitter's recommendation algortihm interjects with content you chose to follow, so some of the content will not be user choice",recommendations spliced into followed content,"With less emphasis on a recommendation features, users chose which communities they want to view content from","Users can chose whether or not to enable the recommendation algorithm, so it is possible to only view content from bloggers you chose to follow. Word and tag blocking further let you limit content you do not want to see.",Recomendation only,The friends you chose to add will be the only content you see,"Since YouTube content is videos, it is a choice to watch an consume content. Tiktok has a little less control, as it is based on watch video perscribed for you, while YouTube gives a menu of options which users chose from.","Answers vary wildly here, but, most users will be interacting with friends or viewing stories of their close connections. Some of the tabloid content cannot be avoided",Users tend to troll other forums,"The long-form nature of Twitch content main users will chose to watch a streamer for a while, and then switch to another. Instead of the scrolling and searching nature of social media, Twitch users tend to chose content for themselves.",,
A2,TRUE,I can control the quantity and types of advertisements I see.,Most social media platforms use ads as a primary revenue source.,"Facebook makes $114 Billion dollars annually off of it's ad spots. Although there are some tools for hiding certain ads and understanding what demographics users are targetted as, they may not be widely known or understood by users. ","LinkedIn makes $3B dollars annunally off of it's ad spots. There are settings to disable personlized ads and a premium model, which may be why our participants y lean towards slightly disagree over strongly disagree, but this may just as well be because our survey respondents may primarily use profile features, when ads show up in the feed.","$231.8M, can turn of personalization","$17.4B, some tools, one of the best ad recommendation algortihmns for shopping, in our opinion","$438 Million, much lower than competitors","Not released figures, Complys with ad laws in certain states, but turning of personalization may not be avaliable to all users. Hide Ads. Blaze culture","$3.9B, tools to understand interest and gender targets, and can turn them off",No ads!,"$28B, google account does have settings","$3B, are settings to disable",Same number of No Ads to Strong Disagrees. Web only + adblockers. There are no settings to change ads,"$231.8M, subscriptions remove ads on that channel",,
A3,TRUE,The platform recommends me content that aligns with my previous interests.,"Social media wants to entertain you, so, overall, all platforms will tend to show you things you are interested in.","Although Facebook's recommendation algortihm will recommend you your interests, it is not as good at it as it's video counterparts. Your connections posts will show up frequently, which may or may not relate to your hobbies. ","LinkedIn is not known for a strong recommendation algorithm. The feed will mostly be comprised of posts your connections have likes or companies you have followed, not recommended content. The professional attitude means much of the content will not align with hobbies, but may align with your professional interests.","Although Twitter recommendation algortihm will recommend you your interests, it is not as strong at it as it's video counterparts.","Although Instagram's recommendation algortihm will recommend you your interests, it is not as strong at it as it's video counterparts.","Although Reddit's recommendation or ""hotness"" algortihm will recommend you your interests, it is not as strong at it as it's video counterparts.","Tumblr's content depends on what you follow; tags and blogs. Although tumblr is experimenting wiht recommendation algorithmns, the general user base hasn't warmed up to it yet and instead rely on their own content filtering.","Along with Youtube, Tik Tok's watch-time based video recommendation algorithm is good at finding videos that align with user interests. As long as you watch videos you are interested in, the algorithmn will get better at showing you videos you are interested in. With lower barrier to entry due to shorter videos and trends, there is more content for the algorithmn to recommend even faster. ",BeReal does not have a recommendation alorithmn. It is exclusivly your friend's posts from within the last 24 hours.,"Along with Tiktok, Youtube's watch-time based video recommendation algorithm is good at finding videos that align with user interests. As long as you watch videos you are interested in, the algorithmn will get better at showing you videos you are interested in.",Snapchat's tabloid content and lack of creators makes it weaker than other social media for recommendations. It is much stronger as a messenger app.,"4Chan is known for shocking content and completely lack a recommendation algorithmn, so users do not often go there to find stuff they know they will like.. ","There is high variance in these answers. Twitch tends to recommend channels based on view count or content types you have previously watched (for example. if you watch a streamer play a video game, you may be recommended other streamers playing this game). In general, Twitch is creator driven, so you may be recommended a creator you end up liking even if you don't like the games they olay.",,
A4,TRUE,I find content on the platform that I wish I had not seen.,"Sometimes the internet will show you content that feels like a waste of time or is actively painful or annoying to think about. In general, this will happen ocassioanlly accross all platforms, but some have more shock prone cultures than others.","The recommendation algorithmn is not very strong, but can still recommend content that feels like a waste of time or makes your day a little worse. If you can stick to content from trusted loved ones, you may avoid some of this content, but Facebook was one of the lower performing platforms on this question.","Once again, the culture of professionalism keeps shocking content to a minimum.  ","Completely rec algo based, and sometimes the algorith will miss",rec algo good and bad,"sometimes shocking content, tied 2nd to last with twitter and fb","Surprising and strange content may still pop up on your dash, but high moderation tools let users control what they do not want to see.",,"BeReal's special content design means that the posts you will see are just your friends, so, unless a friend posts something in their one post for the day, you will likely be safe from shocking content ","In general, Youtube prefers to recommend monetized videos, and those tend to follow community guidelines. Although rabbit holes and surprising videos can leave you feeling shocked, Youtube trys to be very business friendly.","Answers vary wildly here, but, most users will be interacting with friends or viewing stories of their close connections. Some of the tabloid content can be shocking, but sticking with content posted by connection will keep you safe.","Low moderation, shocking boards",Strong community led content moderation,,
A5,TRUE,The platform fosters a safe environment for all users.,"Although many social media strive to encourage a safe environment for all, success varies widly. User culture tends to determine how safe a platform feels, but some recommendation algortihms can lead to dangerous rabbitholes with harmful rhetoric.","Facebook has struggled with its contents moderation. Reportadly, Facebook used to prioritized posts with ""angry"" reactions in the news feed, which was critized for likely spreading more controversial content that could lead to more controversy within user spaces. Facebook struggles with scammers and data harvesting with third party apps, which can lead to, in the worst cases, identity theft.","LinkedIn lets you privatize almost everything on your profile, with granualar preference based on degrees of connection to a person. The business focused culture keep interactions clean and professional, so issues like bullying and hate speach are often mitigated by the culture.","Debate culture, but can have good circles","mostly friends so most users will have a safe experience, but discussion of body image issues","known for debate culture, with some niche content that can create unsafe spaced.","Early Tumblr culture revolved around intensely feminist ideas, which encourage reflection on issues that disadvantaged people face, such members of the LGBT community, people of color, or disabled people. This culture historically was, at times, more argumentative that accepting, but the ideals of their ideologies guide the community to be more understanding than others communities are. Furthermore, Tumblr provides tools to block words or tags to help users moderate their own content. The general culture also encourages blocking other blogs for any reason at all to curate your own experience, further empowering users to create pleasant online spaces for themselves.",algorithmic bubbles,"High privacy, based on friendship, culture based on your friends culture.","less discussion, more creator led, but algortihmn can push dangerous rhetoric. Many users wont see any unsafe content, but some may and some creators may be bullied ","The disappearing pictures can make sharing risque content tempting but data hacks make it dangerous. Snap maps, if left unattened, let any connection know your location, which can be abused. Some believe that the Snapchat filters have led to body dismorphia in teens. ",Known for shocking content,"high moderation tools, mod teams. recently banned gambling.",,
A6,TRUE,I revisit content on the platform.,"Users tend to revist content on social media, as they might want to review content they found entertaining, but it varies greatly. This questions hoped to illuminate the searchablity of certain websites, as you cannot revisit content if you cannot find it, as well as the value of revisiting content on certain sites.","Many users revisit content from Facebook, whether to share funny videos with friends or to look back on photos with loved ones. The ""saved"" and ""memories"" pages let you look back on content you've made or marked.","LinkedIn content is business focused, so it won't be revisited for entertainment purposes as often as other media. There are features for saving posts and jobs, but those rely on user action, and it;s search features aid primarily in finding pages and current chatter, not revisiting a post. Our users may primarily use profile features, so this data may be skewed.","High variablity, but when tweets are so short, they are hard to search, rely on likes and saves","High variablity, but post search options are limited unless tags are extensively used and, even then, those posts may get drowned out. rely on likes and saves","Reddit's search features, which can filter by subreddit and search in comments, allows for easy access etcetc, though some do not","One of the highest for revisting among our participants. Tagging, infimous posts returning to the dash, drafts","Unique video content and culture, with catching facts + story times, want to revisit with friends / earworms. videos lack ""titles"" to search features are not as strong as contemporaries, so may be unable to revisit",Dissappearing,"This is overwheleming the top social media website for revisiting content. YouTube's search is advanced, relying on video popularity, titles, tags, and more. searchable history, watch later, playlist saving","Disappearing, consistent content is ""tabloid"" content","High variability, but the low search features impare re-visitability.","High variability, but some may put on their favorite vods from streamers they like while others may only enjoy the live experience",,